number,text,label
train-1264,"Like many Washington lobby groups, the U.S. Travel Association was quick to congratulate the new president on his victory last November.

""We are encouraged that Mr. Trump's extensive business and hospitality background ...will make him a ready and receptive ear,"" the trade organization said. On the Republican's inauguration, the USTA's chief executive officer, Roger Dow, pledged the industry as a ""capable, willing partner.""

But almost immediately things started to go sideways. A steady drumbeat of news and policy proclamations seemed likely to damage America's $250 billion travel industry and its roughly 15 million U.S. employees.",0
train-1265,"SAN FRANCISCO - President Trump's relationship with Silicon Valley has always been volatile at best, but it seems things soon may get even more contentious.

The CEOs of Microsoft, Apple, Netflix, Uber, Airbnb and Tesla Motors noted the policy was affecting their own employees working here legally, and would jeopardize their competitive quest for talent. Google CEO Sundar Pichai was among the first to condemn the order, noting that it impacted nearly 200 employees, risking stranding some abroad.


Administration officials have drafted a new executive order aimed at overhauling, among other things, the H-1B work-visa program that technology companies have long relied on to bring top foreign engineering talent to their U.S.-based locations.",0
train-1266,"A federal appeals court Thursday refused to let President Trump reinstitute a temporary ban on travelers from seven majority-Muslim nations, ruling that it violates the due process rights of people affected without a sufficient national security justification.

The unanimous verdict quoted a 75-year-old Supreme Court precedent that said courts have a duty ""in time of war as well as in time of peace, to preserve unimpaired the constitutional safeguards of civil liberty.",0
train-1267,"The federal judge who blocked President Trump's immigration ban spent more than 30 years in private practice before taking the bench, giving up a lucrative career that saw him representing breweries, energy companies and Southeast Asian immigrants.

Trump tweeted Saturday morning that he thought U.S. District Senior Judge James Robart's temporary restraining order was ""ridiculous,"" and declared it would be overturned.

Robart, who Trump demeaned as a ""so-called judge,"" was appointed to the bench by President George W. Bush in 2004 after receiving unanimous support from the U.S. Senate.",0
train-1268,"Washington (CNN)President Donald Trump's government moved swiftly Saturday to comply with a federal judge's order halting his travel ban -- even as Trump himself denounced the judge -- but readied its legal defense of the controversial executive action.

The Department of Homeland Security announced it has suspended all actions to implement the immigration order and will resume standard inspections of travelers as it did prior to the signing of the travel ban. But it said the Justice Department -- which is expected to file an emergency motion to stop the order -- needed to challenge the ruling ""at the earliest possible time.",0
train-1269,"When longtime friends and associates of President Donald Trump want to reach him, they don't go directly to the White House. Instead, they call the woman who's been the gatekeeper at Trump Tower for a quarter century: Rhona Graff.

Since Trump took office in January, Graff has become a conduit for those who want to quietly offer advice, make personnel suggestions or get on the president's calendar when he's at his Mar-a-Lago resort in Florida. The list includes investor Ken Langone and Hank Greenberg, the chairman & CEO of CV Starr whose assistant recently went to Graff about trying to set up a lunch with Trump, according to a person with knowledge of the call.",0
train-1270,"In business, as a candidate and now as president, Mr. Trump has valued loyalty as the defining attribute in family, aides or Republicans in Congress. He does not always get it, as the defection of the Freedom Caucus last week on the health bill he was trying to pass made abundantly clear.

But Mr. Trump can always count on Ms. Graff's allegiance, and that has made Ms. Graff, from her office in Trump Tower, a major figure in the operations of the White House for a simple reason: She is believed to have a direct line to the president.

With her deep Queens accent and unerring deference to her boss (she has always referred to him as Mr. Trump or, usually, as Mr. T), Ms. Graff, 64, is a familiar voice to New York's business leaders, the nation's political reporters and now old associates hoping to circumvent the normal channels of communication to reach Mr. Trump.",0
train-1271,"Jill Stein, the presidential candidate for the Green Party, says she would be unhappy with either mainstream party candidate -- Hillary Clinton or Donald Trump -- in the White House.

""No doubt, I will feel really terrible if Donald Trump becomes president. But I will also feel really terrible if Hillary Clinton becomes president,"" Stein told ABC News Political Director Rick Klein and Deputy Political Director Shushannah Walshe on this week's ""Powerhouse Politics"" podcast.

""Because, unfortunately, many of the really scary things Donald Trump talks about, Hillary Clinton in fact has already done,"" Stein added, referring to Clinton's positions on Libya and affairs in the Middle East.",0
train-1272,"WASHINGTON - Nearly three weeks after Election Day, Hillary Clinton's campaign said on Saturday that it would participate in a recount process in Wisconsin incited by a third-party candidate and would join any potential recounts in two other closely contested states, Pennsylvania and Michigan.

The Clinton campaign held out little hope of success in any of the three states, and said it had seen no ""actionable evidence"" of vote hacking that might taint the results or otherwise provide new grounds for challenging Donald J. Trump's victory. But it suggested it was going along with the recount effort to assure supporters that it was doing everything possible to verify that hacking by Russia or other irregularities had not affected the results.",0
train-1273,"MADISON, Wis. - Green Party candidate Jill Stein paid $3.5 million Tuesday to clear the way for Wisconsin's presidential vote recount but had a judge reject her lawsuit to require all Wisconsin counties to do the recount by hand.

Dane County Circuit Judge Valerie Bailey-Rihn said the effort to force the hand recount, which was backed by Democrat Hillary Clinton's campaign, did not meet the state's legal standard for prohibiting the use of machines in the recount, saying that the two campaigns did not show a hand recount, though more thorough, was necessary or show there was a clear and convincing evidence of fraud or other problems.

Bailey-Rihn said there were good reasons to do a hand recount but no legal basis for her to mandate it.",0
train-1274,"On Saturday  the public gets a chance to say a final farewell to Carrie Fisher and her mother  Debbie Reynolds  who died one day apart late in December. The memorial will be held at the Hall of Liberty at Forest Lawn Cemetery Hollywood Hills at 1 p.m. PT. Fans can attend on a first-come  first-served basis  and when the hall fills up  they'll be able to stand outside and watch the service on screens. Can't make it to California? The whole thing will be live-streamed on Reynolds' website. Reynolds' son  Todd Fisher  told Variety not long ago that the memorial was what his mother would have wanted. ""She was very connected to her fans and felt they were a part of her  he said. Todd Fisher also said that a video of a song that James Blunt wrote as a tribute to his sister will be released on the day of the memorial. Blunt and Carrie Fisher were good friends; before he found fame with his hit You're Beautiful  he actually lived with her. It might rip your heart out  Fisher said of the song.",0
train-1275,"Big or small  Chris Pratt has heard it all. These days  the ""Guardians of the Galaxy"" star  37  is taking flak for being too thin  but he's not taking it lying down. Pratt  who has been documenting the healthy snacks he's eating while filming ""Jurassic World 2"" in a series of ""What's My Snack"" Instagram videos  fired back -- in his usual tongue-in-cheek manner -- after some followers apparently suggested he looked too thin. ""So many people have said I look too thin in my recent episodes of #WHATSMYSNACK  he wrote on Instagram Thursday. Some have gone as far as to say I look 'skeletal.' Well  just because I am a male doesn't mean I'm impervious to your whispers. Body shaming hurts.""",0
train-1276,"Elton John knows how to throw a party  and he didn't disappoint when he turned 70 on Saturday night. The English singer gathered his friends  family and many A-listers to fete him inside Red Studios in Los Angeles. The evening was hosted by Rob Lowe and featured performances by Stevie Wonder  Lady Gaga  Ryan Adams and more. At one point during the party  Wonder performed his iconic rendition of ""Happy Birthday"" with help from Lady Gaga. Other celebrities attended the gala  which also served as a benefit for the Elton John AIDS Foundation and the Hammer Museum at UCLA. Neil Patrick Harris  Jon Hamm  Heidi Klum  Dakota Johnson  Jennifer Tilly and Katy Perry were all spotted at the party.",0
train-1277,"The Oscar-nominated actor Jake Gyllenhaal opened up about his role in the new sci-fi thriller ""Life"" in an interview with ""Good Morning America"" anchor Michael Strahan that aired today and also spoke out about his friendship with co-star Ryan Reynolds. In ""Life  Gyllenhaal plays Dr. David Jordan, who is leading a crew on a mission to discover life on Mars. He said his character looked at humanity ... and was a real cynic."" ""He'd seen a lot of tough stuff as a doctor. I think he worked in war-torn areas and stuff  Gyllenhaal said of his character, adding that he maybe hoped that space would be as we all hope  the new frontier."" ""It was interesting to play a character like that  because I feel the same way sometimes about things that are going on down here  he said. But I think being here and staying here  particularly in this country  you know  now and in the world  is the most important thing."" Gyllenhaal added that he would not go into outer space even if he could  saying  ""I'd like my feet on the ground  you know.""",0
train-1278,"Oscar-winner Reese Witherspoon took to Instagram on Sunday to post a heartfelt anniversary message to her husband of six years  agent Jim Toth. ""Six years ago I was lucky enough to marry this wonderful man. He makes me laugh everyday and supports me in everything I do. Happy anniversary  JT! Here's to many more!"" she wrote next to a picture of the happy couple watching the sunset on the beach. The ""Big Little lies"" star married Toth in 2011 in California. They are parents to son Tennessee  4. It's been a big week in other ways for Witherspoon  as she celebrated her 41st birthday. ""On top of the world from all of your sweet birthday wishes!"" she wrote in an earlier post. ""There's nothing better than celebrating my birthday with my wonderful kids!"" she added in another Insta pic.",0
train-1279,"Millie Bobby Brown has been promoting ""Stranger Things"" seemingly nonstop lately and is now taking some time for herself. Brown  who plays the mysterious Eleven on the hit Netflix series  posted an apology to fans on Instagram after having to cancel an appearance. ""I have had to cancel a Comic Con last minute  which is something I've never  never done  and I'm planning on never doing again  Brown said in the video. I just think I've worked too hard and I have to rest  as I've had a really long shoot and I'm still filming 'Stranger Things.'"" The 13-year-old has been seen hitting a string of red-carpet and high-profile events  often alongside her fellow cast members.",0
train-1280,"Ebony Banks  the Houston teen battling a rare form of cancer  has died -- just days after her wish to speak to her idol Beyonce was fulfilled. A spokesman for Alief Independent School District  where Banks was a student  confirmed that she passed away early Sunday morning. ""I understand she had a smile on her face till the very end  spokesman Craig Eichhorn told ABC News. Hours later, the students at Alief Hastings High School, from which Banks had recently graduated and where she was a member of the color guard for four years, organized a candlelight vigil in the band practice lot. Members of the color guard held their candles up in the air and swayed along to the song Halo"" by Beyonce.",0
train-1281,"People confirmed that the couple welcomed a second son  Hal Auden Cumberbatch  on March 3. Cumberbatch has not yet commented on the birth  and his rep has not responded to a request for comment from ABC News. The ""Doctor Strange"" star announced in October that he and his wife  a theater director  were expecting their second child.  ""Everyone is absolutely thrilled  his rep told E! News at the time. Cumberbatch, 40, and Hunter, 38, were married in February 2015, following a short engagement. That June, Hunter gave birth to their first child, Christopher Carlton Cumberbatch. Benedict Cumberbatch and Sophie Hunter are delighted to announce the arrival of their beautiful son. We would kindly ask everyone to respect the family's privacy during these next few precious weeks  his rep said upon Christopher's arrival.",0
train-1282,"After the full ""Justice League"" trailer dropped on Saturday  many fans had one major question: ""Where is Superman?"" Some said the clip  which features the likes of Batman  the Flash  Aquaman and Wonder Woman  isn't complete without the Man of Steel. Although he hasn't yet made an appearance in the ""Justice League"" trailers (the first one was released last year at Comic-Con)  Henry Cavill  who plays Superman  is listed on IMDB in the ""Justice League"" cast. So  he's coming back somehow. Furthermore  the clip from this weekend was the first to feature Amy Adams  who plays Clark Kent's love interest  Lois Lane. If you recall from ""Batman v Superman  the Flash travels back in time and mentions Lois is the key to something. Another teaser at the end of Dawn of Justice"" was the floating dirt on Superman's grave. This was director Zack Snyder's best effort to tell fans he's most definitely coming back. Snyder so far has been mum about these important details. Snyder did  however  speak to USA Today over the weekend and touched on the imminent comeback of one of the greatest heroes in comic book history. ""It's hard to have a 'Justice League' without Superman. That's how I feel about it  he said. It was always a super-intriguing concept to me to have this opportunity to have him make that sacrifice but also have him be this  in a weird sort of way  the why of 'Justice League:' What do you do now with him? What does the team think? What does the world need? All that comes into play. It's fun for us but it'll be interesting for audiences what we do with him.""",0
train-1283,"Actress Scarlett Johansson opened up about her new film  ""Ghost in the Shell  addressing the controversy surrounding her being cast as the heroine and discussing the difficulties of being a woman in Hollywood, in an interview with Good Morning America"" anchor Michael Strahan that aired today. Johansson said that when ""Ghost in the Shell"" was first brought to her attention it ""seemed incredibly daunting  adding that her daughter was still very young, and my head space was not at all like  in the 'Ghost in the Shell.'"" ""But I thought  gosh  it's really hard to turn down the opportunity to be front and center for something that has such a built-in fanbase that's like  so dedicated and totally obsessed  the actress said. And also  you know  to be able to have the studio back something like this  Johansson added, as an actor ... as a woman  it's rare. I hope it's not always so rare  but it is.""",0
train-1284,"Good news for fans hopelessly devoted to ""Grease"" stars John Travolta and Olivia Newton-John. Newtwon-John told Britain's The Mirror that a reunion could be in the works next year to mark the 1978 film's 40th anniversary. The Australian actress and singer  68  confirmed that she and Travolta have been discussing ideas for a reunion  but she didn't divulge any details. Speaking ahead of the Fame Awards at Hard Rock Live in Las Vegas  where she was receiving the Icon Award  Newton-John told The Mirror  ""We are thinking up ways. Nothing to announce yet."" ""Forty years anniversary of 'Grease ' which I can't believe  she continued. Time goes so fast. It is so exciting."" Marking the 40th anniversary could be one of Newton-John's last performances before she retires from 50 years in show business. ""As time goes on I think of doing less and having more time off  she said. But it wouldn't be the first time the thought has crossed her mind. Every year for the last 20 years  I thought I was retiring and then somebody would say  'How about this?' and it's like  'Oh  that looks fun ' or 'How about this?'"" Newton-John admitted. ""Things that I would never think about.""",0
train-1285,"White House Press Secretary Sean Spicer told a reporter to ""stop shaking your head"" during an exchange at his daily press briefing Tuesday. Spicer appeared annoyed by April Ryan  Washington bureau chief for American Urban Radio Networks  when she asked what President Trump's administration would do to revamp its image following reports of its ties to Russia. Spicer objected to the premise  saying: ""I appreciate your agenda here. At some point  report the facts."" He said there has been no proven collusion between Trump associates and Russian officials over interference in last year's election  quipping that ""if the president put Russian salad dressing on his salad tonight  somehow that's a Russian connection."" Spicer said Ryan appeared ""hell-bent"" on projecting her own image of the White House when she asked what Trump might be doing to repair a relationship with former Secretary of State Condoleezza Rice  who did not support his campaign and was meeting with the president later this week. ""Please stop shaking your head again  Spicer said to Ryan. He said the president was fulfilling a promise to build bridges with both supporters and opponents.",0
train-1286,"The Walt Disney Studios unveiled the fifth installment in their ""Pirates of the Caribbean"" franchise ""Dead Men Tell No Tales"" Tuesday night at CinemaCon in Las Vegas. Initial reactions from those in attendance  including press  theater owners and exhibitors  were largely positive  celebrating a return to form for the franchise and the well-done VFX. Official reviews are under embargo until May 22. The swashbuckling film sees the return of Johnny Depp as Captain Jack Sparrow and Geoffrey Rush as Barbossa and introduces a new young cast including Brenton Thwaites and Kaya Scodelario. Javier Bardem plays a ghostly villain with a vengeance as they all search for the trident of Poseidon on the high seas. Orlando Bloom also returns as Will Sparrow  who hasn't been in a ""Pirates"" film since 2007's ""At World's End."" ""Dead Men Tell No Tales"" is the first ""Pirates"" film since 2011's ""On Stranger Tides"" and the first to be directed by Joachim R?nning and Espen Sandberg. To date  the franchise has grossed over $3.73 billion worldwide for the studio  and there is some pressure on this fifth film to continue the enormous successes of the previous films while also redeeming its lagging reputation.",0
train-1287,"Patricia Arquette and more react to United Airlines leggings incident  ""After United Airlines barred two girls from boarding a flight this weekend because they were wearing leggings  which the company said is part of their policy for relatives and friends of employees who travel for free on standby  actors and activists have taken to social media to criticize the airline's choices in the incident. Activist Shannon Watts first tweeted the incident early Sunday  writing  ""A @united gate agent isn't letting girls in leggings get on flight from Denver to Minneapolis because spandex is not allowed?"" Watts is a mother of five and the founder of Moms Demand Action for Gun Sense in America. After major news outlets picked up reports of the incident in Denver  a spokesman for the airline confirmed the report to ABC News  adding that two teens weren't allowed on the flight because leggings are ""not in compliance with dress code policy for company benefit travel  a program that lets the airline's workers and their families travel for free, but within certain guidelines. There are different rules for these privileges because people are flying for free  the spokesperson added.",0
train-1288,"Katy Perry has paid special tribute to an 18-year-old superfan who died in a car accident. According to ABC affiliate KTBS-TV in Shreveport  Louisiana  18-year-old Katie Bell died this past weekend when she lost control of her car and collided head-on with another vehicle. The other driver was also killed. ""We see you angel and we love and will miss you  Perry tweeted on Tuesday morning. KC's  light a candle for Katie. Rest In Peace."" She included one of Bell's videos in her tweet. News of Bell's death apparently inspired the hashtag #RIPKatycatKatie -- Perry fans call themselves ""KatyCats"" -- and Perry herself took notice. To further honor Bell  Perry changed her name on her Twitter profile to Bell's hashtag.",0
train-1289,"Alec Baldwin has revealed that he almost passed on playing Donald Trump on ""Saturday Night Live."" The actor told Vanity Fair for its April cover story that he originally passed on ""SNL"" producer Lorne Michaels' offer to play Trump but changed his mind after a film role fell through. ""I was supposed to do a film. And the people who were doing the film were supposed to escrow money to guarantee that I would get paid  he said in a video accompanying the cover story. And they didn't put the money in escrow. And that's when I hung up and said I'm not going to go do the movie and I'm going to go do the thing with Lorne. And I think to myself  'What if I hadn't done that?' ... It's turned out to be this incredible opportunity."" Baldwin's impression has been so popular that he has parlayed it into an upcoming satirical book and made his record 17th appearance as host of ""SNL"" earlier this year. He talks about playing Trump  working with ""SNL"" stars Kate McKinnon and Tina Fey  and starring in the best role of his life in his new memoir ""Nevertheless  due out next month. Vanity Fair published an exclusive excerpt.",0
train-1290,"The chance to play the late David Bowie's piano while enjoying unobstructed views of Central Park in a New York City apartment could be yours for $6.495 million. A three-bedroom  two-and-a-half-bath apartment once owned by Bowie and his wife  Iman  went on the market on Monday. The couple sold the apartment  located in the Essex House on Central Park South  in 2002  10 years after they wed. Bowie's Yamaha piano was included in the 2002 sale and has remained in the apartment ever since. The current sellers  who did not buy the apartment from Bowie and Iman  are keeping the tradition alive by including the piano in the listing price. ""I would imagine it is hard to move but I think it's really a great catch for buyers  the apartment's exclusive agent, Bernice Leventhal of the Corcoran Group, told ABC News. The 1,877-square-foot home is used as a pied-à-terre by its current owners. It features a limestone foyer, walk-in closet, two master-sized bedrooms and a master bath with a rain shower and heated floors.",0
train-1291,"Michelle Pfeiffer is juggling a much busier schedule these days. Speaking with director Darren Aronofsky for Interview magazine  she said her Hollywood career was put on the back burner after she had children  but she's now ready to get back in the game. ""I've never lost my love for acting. I feel really at home on the movie set. I'm a more balanced person honestly when I'm working  Pfeiffer told Aronofsky. But I was pretty careful about where I shot  how long I was away  whether or not it worked with the kids' schedule. And I got so picky that I was unhirable."" She's now an ""empty nester  she said; her daughter Claudia Rose Pfeiffer is 24 and son John Henry Kelley is 22. This has given her the ability to take on more roles. This year, she'll be seen in HBO's The Wizard of Lies"" alongside Robert De Niro  Aronofsky's ""Mother!"" and an adaptation of Agatha Christie's ""Murder on the Orient Express  which will also star Johnny Depp, Josh Gad and Penelope Cruz. She also starred in the indie film Where Is Kyra?"" which premiered earlier this year.",0
