number,text,label
train-1168,"A Czech stockbroker who saved more than 650 Jewish children from Nazi Germany has died at the age of 106. Dubbed Britain's Schindler, Nicholas Winton arranged to transport Jewish youngsters from Prague after Germany annexed Czechoslovakia in March 1939. Though the children were originally set to arrive in Britain by plane, the German invasion forced Winton to transport them by train through Germany before they eventually reached England by boat. Winton arranged eight trains, known as the Kindertransports (children's transports), to evacuate the children, and died on the anniversary of the 1939 departure of the one carrying the largest number of children: 241. Winton was knighted by Queen Elizabeth II in 2003 for his efforts, despite keeping it secret for nearly 50 years.",0
train-1169,The international scientific community accepts that increases in greenhouse gases due to human activity have been the dominant cause of observed global warming since the mid-20th century. Continued emissions of greenhouse gases will cause further warming and changes in all components of the climate system.,0
train-1170,"In eastern Australia, there is high confidence that in the near future (2030) natural variability will predominate over trends caused by greenhouse gas emissions. This means that while the trend is skewing the natural variability towards winter decreases, it will be relatively minor compared to the natural seasonal and annual changes, so continuing to manage for large natural variability will still be appropriate. For late in the century (2090), there is medium confidence in a winter rainfall decrease.",0
train-1171,There is high confidence in decreasing soil moisture from mid-century in the southern regions (particularly in winter and spring) driven by the projected decrease in rainfall and higher evaporative demand. There is medium confidence in decreasing soil moisture elsewhere in Australia where evaporative demand is projected to increase but the direction of rainfall change in uncertain.,0
train-1172,The international scientific community accepts that increases in greenhouse gases due to human activity have been the dominant cause of observed global warming since the mid-20th century. Continued emissions of greenhouse gases will cause further warming and changes in all components of the climate system.,0
train-1173,"Earth’s climate has changed over the past century. The atmosphere and oceans have warmed, sea levels have risen, and glaciers and ice sheets have decreased in size. The best available evidence indicates that greenhouse gas emissions from human activities are the main cause. Continuing increases in greenhouse gases will produce further warming and other changes in Earth’s physical environment and ecosystems.",0
train-1174,"Global climate has varied greatly throughout Earth’s history. In the final decades of the 20th century, the world experienced a rate of warming that is unprecedented for thousands of years, as far as we can tell from the available evidence. Global average temperature rise has been accompanied by ongoing rises in ocean temperatures, ocean heat storage, sea levels and atmospheric water vapour. There has also been shrinkage in the size of ice sheets and most glaciers. The recent slowdown in the rate of surface warming is mainly due to climate variability that has redistributed heat in the ocean, causing warming at depth and cooling of surface waters. Australia’s climate has warmed along with the global average warming.",0
train-1175,"If greenhouse gas emissions continue to grow rapidly, it is expected that, by 2100, the global average air temperature over the Earth’s surface will warm by around 4°C above mid-19th century temperatures. There are many likely ramifications of this warming. However, if emissions are reduced sufficiently rapidly, there is a chance that global average warming will not exceed 2°C and other impacts will be limited.",0
train-1176,"Sea levels have risen during the 20th century. The two major contributing factors are the expansion of sea water as it warms, and the loss of ice from glaciers. Sea levels are very likely to rise more quickly during the 21st century than the 20th century, and will continue to rise for many centuries.",0
train-1177,"Climate change has impacts on ecosystems, coastal systems, fire regimes, food and water security, health, infrastructure and human security. Impacts on ecosystems and societies are already occurring around the world, including in Australia. The impacts will vary from one region to another and, in the short term, can be both positive and negative. In the future, the impacts of climate change will intensify and interact with other stresses. If greenhouse gas emissions continue to be high, it is likely that the human-induced component of climate change will exceed the capacity of some countries to adapt.",0
train-1178,"Societies, including Australia, face choices about how to respond to the consequences of future climate change. Available strategies include reducing emissions, capturing CO2, adaptation and ‘geoengineering’. These strategies, which can be combined to some extent, carry different levels of environmental risk and different societal consequences. The role of climate science is to inform decisions by providing the best possible knowledge of climate outcomes and the consequences of alternative courses of action.",0
train-1179,"There is near-unanimous agreement among climate scientists that human-caused global warming is real. However, future climate change and its effects are hard to predict accurately or in detail, especially at regional and local levels. Many factors prevent more accurate predictions, and some uncertainty is likely to remain for considerable time. Uncertainty in climate science is no greater than in other areas where policy decisions are routinely taken to minimise risk. Also, the uncertainty means that the magnitude of future climate change could be either greater or less than present-day best estimates.",0
train-1180,"Human activities are increasing greenhouse gas concentrations in the atmosphere. This increase is extremely likely to have caused most of the recent observed global warming, with CO2 being the largest contributor. Some observed changes in Australia’s climate, including warming throughout the continent and drying trends in the southwest, have been linked to rising greenhouse gas concentrations.",0
train-1181,"Today, human activities are directly increasing atmospheric concentrations of CO2, methane and nitrous oxide, plus some chemically manufactured greenhouse gases such as halocarbons (Question 3). These humangenerated gases enhance the natural greenhouse effect and further warm the surface. In addition to the direct effect, the warming that results from increased concentrations of long-lived greenhouse gases can be amplified by other processes. A key example is water vapour amplification (Box 1.3). Human activities are also increasing aerosols in the atmosphere, which reflect some incoming sunlight. This human-induced change offsets some of the warming from greenhouse gases.",0
train-1182,"Over the past million years, Earth’s globally averaged surface temperature has risen and fallen by about 5˚C in ice-age cycles, roughly every 100,000 years or so (Figure 2.1a). In the coldest period of the last ice age, about 20,000 years ago, sea level was at least 120 metres lower than today because more water was locked up on land in polar ice sheets. The last 8,000 years, which includes most recorded human history, have been relatively stable at the warmer end of this temperature range. This stability enabled agriculture, permanent settlements and population growth.",0
train-1183,"Climate and sea level were relatively stable over thousands of years of recorded human history up to the 19th century, although with some variations (Figure 2.1b). However, globally averaged near-surface air temperature rose by around 0.8°C between 1850 and 2012 (Figure 2.1c). The rate of warming increased in the mid-1970s, and each of the most recent three decades has been warmer than all preceding decades since 1850. The last decade has been the warmest of these. Satellite observations and direct measurements also show warming in the lower atmosphere over the past three decades. In contrast, the atmosphere above about 15 km elevation (the stratosphere) has cooled over this time.",0
train-1184,Explosion rocks down town Damascus. An explosion inside a bus killed six people and injured another ten in down town Damascus according to preliminary reports on Sunday. Syrias government run TV said the explosion took place in Al Kalassa region of the Syrian capital and that 19 people were injured and an unspecified number of others killed.,0
train-1185,"Casualties mount in the Eastern Ghouta city as the regime continues its assault for the tenth day in a row. More than 120 people have been killed as troops allied to the Syrian regime stepped up attacks on Syrias Eastern Ghouta governorate focusing on the city of Douma around 10km northeast of Damascus. Regime aircraft have dropped more than 1000 bombs on the city in at least 150 airstrikes during the past ten days according to analysts. ""Rescue teams and volunteers continue to search for survivors and bodies under the rubble amid the mass destruction of neighbourhoods"" Osama Said a Douma-based media activist told al-Araby al-Jadeed. At least 400 people - mainly women and children - have been injured during this bombing campaign and 500 residential buildings have been destroyed according to the citys monitoring and documentation office. Retaliation The administration of President Bashar al-Assad said attacks had been ramped up after Zahran Alloush leader of the Army of Islam - a merged collection of rebel opposition groups - declared Damascus a military zone [Ar] and shot hundreds of missiles at the capital. 	 	Rescue teams and volunteers continue to search for survivors and bodies. - Osama Said media activist The latest escalation is also an attempt by regime forces to break into Eastern Ghouta which is controlled by the Army of Islam. Douma-based activists have drawn the worlds attention to their tragedy using the hashtag Doumaexterminated and its Arabic equivalent. Pictures and videos of the city posted using the hashtag have shown dozens of severely injured children receiving treatment at makeshift hospitals as well as injured civilians and dead bodies being pulled from the rubble. ""Pictures from Douma and the high civilian body count show the regime is targeting residential areas not military sites"" said Hisham Marwah the Syrian National Coalitions (SNC) vice-president. The regime has used this policy of collective punishment in many parts of Syria since the uprising began he added. Marwah called on the international community to put pressure on Assads regime to stop the massacres immediately. ""The international alliance should add Assads positions to the locations it is targeting in its attacks on the Islamic State group in Syria"" he added. Other locations targeted by Assads troops this week in Eastern Ghouta include the towns of Misraba Ayn Tarma Arbin and Kafr Batna and the al-Wafideen refugee camp. This article is an edited translation from our Arabic edition. ",0
train-1186,"Free Syrian Army and Nusra Front fighters pushed from town of Deir al-Adas and surrounding areas as rebels claim Iranian-backed Lebanese group wants to set up permanent base. Hizballah fighters backed by Syrian and Iranian forces have pushed the Nusra Front and from the town of Deir al-Adas reports say in a major offensive in the Daraa governorate. The London-based Syrian Observatory for Human Rights said Deir al-Adas was taken on Tuesday after two days of fierce fighting between regime elements and rebels including members of Nusra al-Qaedas affiliate in Syria and fighters from the Free Syrian Army. The offensive is part of the operation launched on Sunday to seize areas at the intersection point of the three Syrian governorates of Rif Dimashq Daraa and Quneitra near the disputed Golan Heights. The observatory group said 20 opposition fighters were killed in the fighting including a Hizballah ambush near Deir al-Adas. The groups director Rami Abdulrahman told the AFP news agency that Hizballah was leading the attack on Deir al-Adas and its surrounding hills. Al-Araby al-Jadeed cannot independently verify the reports. Restoring security The official Syrian news agency Sana quoted a military source on Wednesday as saying the army was able to ""restore security"" to Sanei Tal al-Hawa and Tal-Arous in the southwestern countryside of Damascus Tal Meri west of Damascus and al-Danaji and Tal Antar near Deir al-Adas. The opposition Local Coordination Committee of Deir al-Adas said heavy shelling had forced the Free Syrian Army from the town which was now ""in range of their firepower"". Ayman al-Aasmi a member of the FSA southern front command claimed that Hizballah was trying to set up a permanent base in north Daraa to link its positions in southern Lebanon through the hills of Mount Hermon. ""The issue is not just about retaking some towns and hills"" he said. ""Hizballah pushed large forces into the battle mostly made up of Lebanese and Iraqi militias in light of the regime forces collapse in the Daraa governorate as a result of losses in battles with opposition forces defections or redeployment into the hot spots in other governorates."" This article is an edited translation of the original Arabic.",0
train-1187,"Killing Obama administration rules, dismantling Obamacare and pushing through tax reform are on the early to-do list.",0
train-1188,"NEW YORK - Bernie Sanders is at a crossroads.

The Vermont senator took Wednesday off the campaign trail at home alone with his wife, leaving his top aides behind in Washington to cool their heels.

""He wanted an opportunity to think,"" said Sanders senior strategist Tad Devine. ""It's affording him an opportunity to think about where we are in the campaign, what he wants to say in the weeks ahead. He hasn't had a real chance to do that"" in weeks.

The Sanders campaign poured itself into New York, throwing a hail mary pass to try to change the delegate math while they could. They spent $5.6 million (twice what Hillary Clinton did), made 3 million phone calls in the final weekend alone, and organized the biggest rallies of a campaign defined by big rallies.

But in the end Sanders came up short - not just of winning, but of the delegate target allies had aimed to hit, which might set them up for a path through California, the campaign's final hope.

Now, with the nomination even further out of reach, Sanders faces the difficult question about what comes next. Does he set a do-whatever-it-takes course to actually win the Democratic nomination? Or does he return to the message campaign his long-shot White House bid was originally seen as?

There's no question that Sanders will stay in the race either way. ""Bernie made a decision after Nevada that he was going to go through this process and finish it up by letting everybody who wanted to vote, vote,"" Devine said.

Democratic primary voters have shown no sign they're in a rush for the race to settle down, and seem hungry for Sanders' message, if not his presidency.

He'll continue to draw massive crowds from zealous fans, who have almost literally given his campaign a blank check to do as they wish. On Wednesday night, the campaign announced raising $15 million more than Clinton in March, though they also spent much more.

But even some Sanders allies cringed at parts of the candidate's message in New York, where his agenda was sometimes obscured by a focus on Clinton and issues with the election process.

""Going forward, what we're encouraging Senator Sanders to do is to continue to keep the campaign focused on the issues,"" said Neil Sroka, the communications director of Democracy for America, which backs Sanders.

The campaign says they want to return to more substantive issues - but only as long as the Clinton campaign joins them. So far, at least, they believe Clinton forces are keeping up the heat and see it as sign Clinton still views Sanders as a threat.

Privately, some Sanders allies say it's time for the candidate to start to thinking more about how he maximizes his leverage at the Democratic National Convention, and afterwards, and less about beating Clinton at all costs.

One indicator of which kind of campaign Sanders wants to run is how much he and his aides continue to talk about relying on super delegates to hand them the nomination.

The strategy, which calls for wooing the unelected delegates even if Sanders loses more primaries and caucuses, was floated by campaign manager Jeff Weaver with MSNBC's Steve Kornacki late Tuesday night.

MoveOn.org and Democracy for America, both of which have endorsed Sanders, have since 2008 been pressuring super delegates to support whichever candidate gets the most votes.

More than 380,000 people signed petitions from the group agreeing that ""the race for the Democratic Party nomination should be decided by who gets the most votes, and not who has the most support from party insiders.""

Both groups confirmed to MSNBC Wednesday that they still hold that position.

""MoveOn members overwhelmingly endorsed Sanders for president, and we want him to win the most pledged delegates, become the nominee, and become president. But superdelegates shouldn't overrule the will of the Democratic grassroots,"" said MoveOn Washington Director Ben Wikler. ""If the primary and caucus winner is Hillary Clinton, then Clinton should be the nominee.""

Devine said the campaign's main focus is still to win pledged delegates. But if Sanders falls just short of a majority, it's negligible - ""de minims,"" Devine said - and the campaign will pitch super delegates that Sanders is the stronger general election candidate.

Another indication of Sanders' intentions will be where he devotes his precious time in the days leading up to Tuesday's contests.

Five states are voting and Maryland is expected to be Sanders' worst showing.

If he invests heavily there it's a sign his campaign is still focused on winning and scraping together delegates. If he spends time in states like Connecticut and Delaware to try to eek out wins despite limited delegate opportunities, it's a sign he's more focused on moral victories than ones that lead to the nomination.

What Sanders decides to do, and how aggressively he decides to continuing pursuing Clinton, will help determine the shape of the rest of the primary and how quickly Clinton, the odds-on nominee, can unite the party.

Clinton's favorability rating has tumbled during the primary, especially among Sanders voters, presumably at least in part due to his attacks.

But as Democratic leaders worry about the damage, the party seem to be enjoying the contest.

National polling between Clinton and Sanders has tightened to a virtual dead heat, suggesting voters are not ready to settle on Clinton. Exit polls showed two-thirds of New York primary voters found the heated contest in the state to be energizing, not divisive.

""Mr. Sanders's presence has made this an immeasurably more substantive race,"" The New York Times wrote in an editorial Wednesday calling on Sanders to ignore calls to leave the race, which was shared by the Sanders campaign. The enthusiasm of his supporters ""should be a wake-up call to leaders of both parties. They are missing something big about their own members' priorities, and their mood.""

Still, Sanders' entire campaign has been about bringing new people into politics and the Democratic party. At some point, he might risk pushing them back out again.",0
train-1189,"The FBI has expanded its probe of Hillary Clinton's emails, with agents exploring whether multiple statements violate a federal false statements statute, according to intelligence sources familiar with the ongoing case.

Fox News is told agents are looking at U.S. Code 18, Section 1001, which pertains to ""materially false"" statements given either in writing, orally or through a third party. Violations also include pressuring a third party to conspire in a cover-up. Each felony violation is subject to five years in prison.

This phase represents an expansion of the FBI probe, which is also exploring potential violations of an Espionage Act provision relating to ""gross negligence"" in the handling of national defense information.

""The agents involved are under a lot of pressure and are busting a--,"" an intelligence source, who was not authorized to speak on the record, told Fox News.

The section of the criminal code being explored is known as ""statements or entries generally,"" and can be applied when an individual makes misleading or false statements causing federal agents to expend additional resources and time. In this case, legal experts as well as a former FBI agent said, Section 1001 could apply if Clinton, her aides or attorney were not forthcoming with FBI agents about her emails, classification and whether only non-government records were destroyed. It is not publicly known who may have been interviewed.

Fox News judicial analyst Judge Andrew Napolitano said the same section got Martha Stewart in trouble with the FBI. To be a violation, the statements do not need to be given under oath.

""This is a broad, brush statute that punishes individuals who are not direct and fulsome in their answers,"" former FBI intelligence officer Timothy Gill told Fox News. Gill is not connected to the email investigation, but spent 16 years as part of the bureau's national security branch, and worked the post 9/11 anthrax case where considerable time was spent resolving discrepancies in Bruce Ivins' statements and his unusual work activities at Fort Detrick, Md.

""It is a cover-all. The problem for a defendant is when their statements cause the bureau to expend more time, energy, resources to de-conflict their statements with the evidence,"" he said.

Separately, two U.S. government officials told Fox News that the FBI is doing its own classification review of the Clinton emails, effectively cutting out what has become a grinding process at the State Department. Under Secretary for Management Patrick Kennedy has argued to both Director of National Intelligence James Clapper and Congress that the ""Top Secret"" emails on Clinton's server could have been pulled from unclassified sources including news reports.

""You want to go right to the source,"" Gill said. ""Go to the originating, not the collateral, authority. Investigative protocol would demand that.""

On Friday, Clapper spokesman Brian Hale confirmed that no change has been made to the two ""Top Secrets"" emails after a Politico report said the intelligence community was retreating from the finding.

""ODNI has made no such determination and the review is ongoing,"" Hale said. Andrea G. Williams, spokeswoman for the intelligence community inspector general, said she had the same information. Kennedy is seeking an appeal, but no one can explain what statute or executive order would give Clapper that authority.

A U.S. government official who was not authorized to speak on the record said the FBI is identifying suspect emails, and then going directly to the agencies who originated them and therefore own the intelligence -- and who, under the regulations, have final say on the classification.

As Fox News previously reported, at least four classified Clinton emails had their markings changed to a category that shields the content from Congress and the public, in what State Department whistleblowers believed to be an effort to hide the true extent of classified information on the former secretary of state's server.

One State Department lawyer involved in the alleged re-categorization was Kate Duval. Duval once worked in the same law firm as Clinton's current and long-time lawyer David Kendall and at the IRS during the Lois Lerner email controversy. Duval left government service for private practice in mid-September.

Catherine Herridge is an award-winning Chief Intelligence correspondent for FOX News Channel (FNC) based in Washington, D.C. She covers intelligence, the Justice Department and the Department of Homeland Security. Herridge joined FNC in 1996 as a London-based correspondent.",0
