number,text,label
train-1329,Every week  hosts Dan Moss and Scott Lanman bring you a jargon-free dive into the stories that drive the global economy. Post-industrial Midwestern America helped propel Donald Trump to the nation's top job. You've heard that a hundred times. But did you hear about St Louis? A wave of Bosnian refugees  many of them Muslim  arrive in the city  starting in the mid-1990s. The result: a surge in business and job creation  revitalization of the community and help in the transition from a manufacturing to a service economy. Sadik Kukic tells Dan and Michelle about his journey from Balkan concentration camps to a pillar of the local community: He's now president of the Bosnian Chamber of Commerce. What could be more American?,0
train-1330,A long-running squabble between Denmark and Germany over power cables linking the countries has cut the amount of electricity Nordic producers can supply to Europe's biggest market to the lowest level in 17 years.  Germany cut import capacity from mainland Denmark by 89 percent on average last year  the most since a power market between the nations started in 2000. It's a consequence of Chancellor Angela Merkel's unprecedented Energiewende: the shift to wind and solar power mean surges in renewable energy production make it hard for the nation's grids to handle its own electricity  let alone imports.  The dispute is undermining the European Union's goal of breaking down national barriers for power to boost energy security and cut costs through more cross-border trading. Talks between Germany and Denmark have floundered  with no resolution emerging from their latest meeting on the matter in Berlin last week.,0
train-1331,"The London Stock Exchange has said it is continuing to ""work hard"" on its planned merger with Deutsche Boerse. Earlier this week  the LSE said the deal could collapse as it was unlikely to get European Commission clearance. The commission had ordered the LSE to sell its 60% stake in MTS  a fixed-income trading platform. The LSE had called the request ""disproportionate"". The LSE's latest comments came as the exchange reported an increase in profits for 2016. Excluding restructuring costs and businesses it has sold or closed  LSE said profit before tax rose to £623.1m for the year from £516.4m a year ago. ""The group has worked hard on our proposed merger with Deutsche Boerse  which received formal approval from both sets of shareholders  the firm said.",0
train-1332,Chinese tech giant Tencent has spent $1.78bn (£1.4bn) on buying a 5% stake in electric carmaker Tesla. Tencent  best known for its WeChat mobile app  has been investing in a number of sectors  including gaming  entmt  cloud computing and online financing. Tesla said the stake was passive  meaning Tencent would not get a say in how the US firm was run. Shares in Tesla rose 2.3% in early trading following the announcement. Tesla's range of electric cars has included the Model S and the Roadster  which was billed as the world's first electric sports car. The company also specialises in battery storage  and  through its SolarCity subsidiary  residential solar panels.,0
train-1333,"EU regulators have blocked London Stock Exchange's £21bn merger with German stock exchange Deutsche Boerse. The European Commission said the deal would have created a ""de facto monopoly"" for certain financial services. The merger would have combined Europe's two largest stock exchange operators. London Stock Exchange Group said it ""regrets"" the commission's decision  as the deal would have created a ""world-leading"" financial markets firm. It warned last month that the deal was unlikely to receive EU approval over concerns that it would limit competition. The firm  which operates the UK and Italian stock exchanges  had offered to sell its France-based clearing house to deal with those concerns. However  the European Commission decided that this remedy did not go far enough. Margrethe Vestager  the commissioner in charge of competition policy  said: ""The European economy depends on well-functioning financial markets.",0
train-1334,"American Airlines and China's biggest carrier by passengers  China Southern  have agreed a strategic partnership. The US airline will buy $200m (£159m) worth of shares in the Chinese firm and the two will ""seek to increase cooperation"". China Southern is the latest of China's top airlines to bring in an investor from outside the mainland. The deal should offer American Airlines more possibilities to tap into China's growing aviation market. China is one of the biggest sources of tourists to the US  with Chinese carriers aggressively expanding their fleets and range of overseas destinations to cater to the strong growth in traveller numbers.",0
train-1335,"A referendum in Switzerland to clarify the country s relationship with the European Union would be helpful, Swiss President Doris Leuthard said on Sunday, after ties between the two sides cooled this week. Switzerland s frictions with the EU, of which it is not a member, arise as Britain negotiates its withdrawal from the bloc following a referendum in June last year and seeks a new trading relationship with its closest neighbors. Talks on securing a new  framework  treaty to govern the Swiss-EU relationship have been underway for some time, with Brussels wanting to replace the more than 100 bilateral accords which regulate its relationship with Bern. But relations soured this week when the EU granted Swiss stock exchanges only limited access to the bloc, prompting Swiss threats of retaliation for what it called discrimination.  The bilateral path is important,  Leuthard told Swiss newspapers Sonntags Blick.  We therefore have to clarify our relationship with Europe. We have to know in which direction to go.  Therefore a fundamental referendum would be helpful.  Talks on the an all-encompassing agreement made headway last month after Switzerland agreed to increase its contribution to the EU s budget. Such a deal would ensure Switzerland adopts relevant EU laws in return for enhanced access to the bloc s single market, crucial for Swiss exports. But a deal would be opposed by the anti-EU Swiss People s Party (SVP), currently the biggest group in parliament.  Leuthard, who steps down as president at the end of the year, said the latest row had not overshadowed her year in the rotating office.  Of course, the differences with Brussels are now in focus. Here our attitude is clear - for the EU to link such a technical thing like stock exchange equivalency with a political question like the framework treaty, that is not possible,   She said some countries were putting Switzerland in the same category as Britain, while others wanted to strengthen their own financial centers at Switzerland s expense.  Others think we are cherry pickers who benefit too much from the single European market, they want to increase pressure for a framework agreement,  Leuthard said. Pressure from outside would did not contribute to a beneficial climate in Switzerland over a potential agreement, she said. She said she understood Swiss scepticism towards the EU, but there was no alternative to finding an accommodation with the bloc which generates around two thirds of Swiss trade.  We can strengthen the cooperation with India and China, but the EU remains central. We need a mechanism and regulated relationship with the EU, that would also prevent political games like we are having at the moment,  Leuthard said. ",0
train-1336,"Separatists looked set on Friday to regain power in Catalonia after voters rejected Spanish Prime Minister Mariano Rajoy s attempt to neuter its independence movement, instead re-igniting the country s biggest political crisis in decades. Spanish markets recoiled at a surprise result that is also a setback for the European Union, which must now brace for more secessionist noise as it grapples with the disruption of Brexit and simmering east European discontent. By risking a parliamentary election in the region, Rajoy appears to have made the same mistake that leaders including Greece s Alexis Tsipras, Britain s David Cameron and Italy s Matteo Renzi have made in recent years: betting that voters would resolve their troublesome domestic conundrums for them. For an interactive graphics package, click tmsnrt.rs/2AGBazV With well over 99 percent of votes from Thursday s election counted, separatist parties had secured a slim majority. Spain s stock market fell around 1 percent and the country s borrowing costs rose as investors bet the ensuing ramp-up in tensions with its richest region will hurt the euro zone s fourth-largest economy. Rajoy ruled out calling national elections over events that have weakened his authority, while both he and exiled separatist leader Carles Puigdemont said they were open for dialogue.  But they offered no details and such calls in the past have failed to yield any solution.  After several strained months that saw secessionists organize an illegal referendum on Oct. 1, and police confiscate urns to try to prevent it from taking place, the election result has done nothing to resolve the standoff either. The secessionists kept a majority, but it was reduced and they may have difficulty forming a government; and support for unionist party Ciudadanos has surged, but not enough to catapult them into power.  The divisions are huge. It will take time to mend them and that should be the priority for all political actors, reconciliation within the remit of the law,  Rajoy told a news conference at the government s Moncloa headquarters. With Catalonia accounting for a fifth of its economy, Spain had already trimmed growth forecasts for 2018, and the prospect of prolonged uncertainty worries business leaders.   More companies leaving, less economic activity there - and worse for everyone,  said the chief executive of a major listed Spanish company, speaking on condition of anonymity because of the tense climate of the independence debate. More than 3,100 firms have shifted their headquarters out of the region since October s referendum.  Overnight hotel stays rose 2.1 percent in Spain in November but fell 7.3 percent in Catalonia, the National Statistics Institute said.     Rajoy, who called the election after sacking the previous secessionist government, had hoped to mobilise hitherto quiescent supporters of union with Spain and deal separatism a decisive blow. Instead, his own party performed miserably, and the result raises the question of a return to power for Puigdemont, who campaigned from self-imposed exile in Brussels after Rajoy deposed him as Catalan president.  Catalonia is back to square one,  said Marco Protopapa, an analyst at JP Morgan, forecasting that tensions would quickly return between Madrid and an  emboldened pro-independence camp eager to exploit the tactical advantage of a favorable election outcome . While Rajoy dodged questions about whether he would negotiate directly with Puigdemont, the Catalan politician said now was the time for dialogue between the two.  We ve at least won the right to be heard,  Puigdemont said, adding that he was open to returning to Spain if given guarantees that he could take his position as head of a potential new Catalan government. Currently he faces the prospect of arrest for his role in organizing the banned referendum. When the Catalan parliament declared independence after the referendum, Rajoy invoked constitutional powers to impose direct rule from Madrid. He promised to restore Catalonia s autonomy regardless of the election result, but could re-impose it if a new government again pursued secession.     The EU s major powers, Germany and France, have backed his anti-independence stance despite some criticism of his methods at times. Meanwhile, Puigdemont s attempts to gain international support in Brussels have failed so far. He has called the EU a  club of decadent countries  for declining to mediate a solution. A German government spokeswoman on Friday urged reconciliation in Catalonia, adding that the Spanish constitution would have to be respected.  Secessionists say Catalonia pays an unfair share of taxes to Madrid, but investors fear independence would knock the indebted region out of the EU and the euro zone by default.  There is a huge effect on investment from abroad. As there s a lack of stability here, people who were investing here are going to other cities and other regions,  said Rafael Prisco, commercial director in a real estate agent in central Barcelona that deals mostly with foreign clients. Europe now ends the year having struggled to build on the integrationist Emmanuel Macron s victory in the French presidential election in May. Germany faces months of political limbo, Brussels is mired in a nasty dispute with Poland s right-wing government and a far-right party has just entered the government in Austria. In Thursday s vote, Catalonia s separatist parties won 70 of the 135 seats, compared with 72 last time, with Puigdemont s Junts Per Catalunya (Together for Catalonia) retaining its position as the largest separatist force. Ciudadanos (Citizens) won the most votes, but other unionist forces   Rajoy s People s Party and the Socialist Party   performed dismally.  It s a bitter victory,  said Paloma Morales, a 27-year-old student at a Ciudadanos rally.  It means four more years of misery.  ",0
train-1337,"Callista Gingrich, wife of the former speaker of the U.S. House of Representatives, on Friday became U.S. ambassador to the Vatican, which is at odds with Washington over immigration, climate change and Jerusalem. Callista Gingrich, 51, an author, documentary filmmaker and former congressional aide, presented her credentials to Pope Francis at the Vatican to officially assume her role. Her husband Newt Gingrich was an early supporter and vocal ally of U.S. President Donald Trump. Newt Gingrich is expected to continue his role as a political contributor to Fox News from his new base in Rome. Trump s nomination of Callista Gingrich to the post at the Holy See in May caused some controversy because of her marriage to Gingrich, with whom she became involved when he was still married to his second wife. Both are Roman Catholic. On Thursday they attended the funeral at the Vatican of Cardinal Bernard Law, who resigned as Archbishop of Boston 15 years ago after covering up years of sexual abuse of children by priests.  The pope has implicitly criticized Trump s decision to pull out of the Paris accord on climate change. He said last month that denying climate change or being indifferent to its effects were  perverse attitudes  that blocked research and dialogue aimed at protecting the future of the planet. Francis is also opposed to Trump s decision to recognize Jerusalem as Israel s capital. The pontiff has called for respect for the city s  status quo,  saying new tension in the Middle East would further inflame world conflicts.. On Thursday at the United Nations, where the Vatican has permanent observer status, more than 120 countries defied Trump and voted in favor of a resolution calling for the United States to drop its recent recognition. The U.S. embassy said in a statement that the new ambassador  looks forward to working with the Holy See to defend human rights, advance religious freedom, combat human trafficking, and to seek peaceful solutions to crises around the world .    ",0
train-1338,"As he looks back on a momentous year, French President Emmanuel Macron might be tempted to have an extra glass of champagne this holiday season, and not just because he turned 40 on Thursday. A year ago, his newly created En Marche movement was only just starting to gain traction, with the candidate inching ahead of his main center-right rival Francois Fillon in the polls.  But he still faced a full-throated challenge from far-right leader Marine Le Pen, and the idea of a 30-something former economy minister with no party affiliation rising to become president of the republic appeared far-fetched. A year on, and a few wobbles aside, Macron looks to be sitting pretty: he s up in the polls again, the opposition is largely in disarray, the economy is picking up, and business and consumer confidence are strong.  With German Chancellor Angela Merkel, 63, bogged down in draining coalition negotiations, Britain s Theresa May, 61, battling to make Brexit work while holding her divided government together, and President Donald Trump, 71, taking the United States in often unpredictable directions, Macron is arguably the most stable and reliable leader in the West. In the past few weeks alone he has hosted a global climate summit, convened Middle East and African leaders to tackle Islamist militancy in the Sahel, brokered the return of Prime Minister Saad Hariri to Lebanon from Saudi Arabia, and been at the forefront of discussions with Israeli Prime Minister Benjamin Netanyahu over the status of Jerusalem. Next month he will visit China for four days, and in the coming months he is expected to become the first French leader to visit Tehran since 1971   six years before his birth. In Europe, he is credited with standing up to the wave of nationalist populism and unabashedly backing EU integration at a time when such ideas have become a dirty word in many capitals.  Macron s unexpected performance underscores that harsh anti-EU populism is not always a winning strategy,  Erik Brattenberg, director of the Europe Programme at the Carnegie Endowment for International Peace, wrote this week. So as Macron prepares to wind down a little bit at the end of the year, what are the risks? One of the former investment banker s shortcomings has been a tendency to use dismissive, even denigrating, language that has at times made him appear arrogant. Opponents have dubbed him  president of the rich , a label that s proving hard to shake. Referring to those who oppose his economic reforms as  slackers  and suggesting that protesting workers should stop  kicking up a bloody mess  was ready fuel for the center-left opposition and dented his popularity. [nL8N1MG11O]  He faces a challenge to keep his ambitious agenda on track. While he has pushed through changes to the labor rules with minimal unrest, he still needs to secure an overhaul to the pensions and unemployment benefit systems. [nL8N1MM3H0] In Europe, his grand plans for a separate budget for the euro zone have been stymied in large part by Germany s post-electoral impasse [nL8N1OC2QI], and his talk of pan-European lists to run in next year s elections to the European Parliament is unsettling parties and leaders across the continent. He also cannot bank on the opposition being disordered forever. The center-right Republicans party has now elected Laurent Wauquiez, a 42-year-old in the Macron mould, as its leader, and the far-left La France Insoumise keeps promising to put hundreds of thousands of protesters on the streets. What s certain is that 2018 is unlikely to be uneventful.  ",0
train-1339,"France, the European Union s largest farm producer, plans to raise regulated minimum food prices and limit bargain sales in supermarkets in a bid to increase farmers  income, Prime Minister Edouard Philippe said on Thursday. The move is part of a wider field-to-fork review that closed on Thursday. Farmers, an important constituency in French politics, have long complained of being hit by a price war between retailers, which has benefited consumers but hurt producers down the chain. The measures will be put in place for a trial period of two years, Philippe said. Selling at a loss is forbidden in France.  To determine the minimum level at which retailers are allowed to sell a product, France has set a Resale Below Cost (RBC) threshold. The RBC threshold is currently defined by the product s basic purchase price, minus discounts, plus transport costs to the retailer s warehouse. The government will propose to raise the RBC threshold by 10 percent, Philippe said at the close of the food review.  The aim is to rebalance trade relations for the benefit of farmers  income,  he said when describing the proposal. The rise would include some of the additional costs already supported by retailers, such as the cost of logistics and staff needed to bring products from warehouses to the shelves, food industry group Ania said. This will increase the end-price of all products sold between the current RBC threshold and the new one - but not necessarily more expensive ones. The government will propose limiting discounts on food products to 34 percent of a product s price and to 25 percent of available volumes, Agriculture Minister Stephane Travert said. This means that retailers will be able to do promotion offers such as  three products for the price of two  but only for a fourth of their supplies for that product. The war in prices had led to rebates of up to 70 percent, which are most often supported by food producers. The aim of the measure is to avoid consumers losing the  sense of prices.  It would now be promotions, not sell-offs,  Christiane Lambert, head of France s largest farm union FNSEA, said. Analysts say the measures would reduce aggressive price competition among French retailers and accelerate food inflation, potentially benefiting retailers  profit margins in the short-term.  This should calm down the (price) game a bit but the most aggressive players on prices may be tempted to parry an attack,  Raymond James analyst Cedric Lecasble said. A softer competitive climate could come as a relief for retailers like Carrefour (CARR.PA) and Auchan [AUCH.UL], whose profitability is under pressure and whose hypermarkets sales suffer from aggressive price discounting from the market s dominant player, Leclerc, Barclays analyst Nicolas Champ said. Leclerc is now the leading retailer in France with a national market share of 21 percent against 20.5 percent for Carrefour, the latest Kantar data show. Accelerated food inflation could also lead some consumers to trade down, which could benefit hard discounters like Lidl. The limitation of promotions could also benefit discounters who have mostly Every Day Low prices strategies and reduce the attractiveness of the hypermarket stores, which are more focused on promotions. The government s aim is to present draft legislation to Parliament early next year, Philippe said. Analysts say the measures are unlikely to have an impact on the food chain before the second half of 2018. Ania had estimated that a rise of 15 percent in the RBC threshold would cost consumers an average of 30 cents ($0.36) per person and per week. Prices of products currently sold lower than the new RBC floor level - mostly products used to attract consumers such as Ferrero s Nutella or Coca Cola (KO.N) soft drinks - would rise mechanically. The government hopes that the measures will prompt retailers to loosen pressure on suppliers and food makers who would then pass at least part of the rise onto farmers. But some are doubtful that this will happen.  We will increase some products  prices by 10 percent, promising that miraculously this money, taken from consumers, will go down to the agri-food industry and that industry will give this money back to farmers. By what miracle, we do not know, there are no tools,  Olivier Andrault from consumer rights group UFC-Que choisir told Europe 1 radio. The government will also reinforce the so-called renegotiation clause that allows parties to ask that contracts - concluded on an annual basis in France - be reviewed if there is a large swing in production prices. To ensure that farmers are not paid below their costs, France also plans to reverse the process of determining prices by taking farmers  production costs as the starting point. ($1 = 0.8432 euros) ",0
