number,text,label
train-1200,"Author Roald Dahl penned a heartbreaking letter in 1988, urging parents to vaccinate their kids, in which he shared the story of his heartbreak over his own daughter's death from measles.

According to the author's website, Olivia ""Twenty"" Dahl, the oldest daughter of Roald and his wife, Patricia, died in November 1962. A letter written by Dahl about her death was featured in a pamphlet from The Sandwell Health Authority in 1988.

Read the full text of the letter below, via HuffPost UK:

Measles: A Dangerous Illness
Olivia, my eldest daughter, caught measles when she was seven years old. As the illness took its usual course I can remember reading to her often in bed and not feeling particularly alarmed about it.

Then one morning, when she was well on the road to recovery, I was sitting on her bed showing her how to fashion little animals out of coloured pipe-cleaners, and when it came to her turn to make one herself, I noticed that her fingers and her mind were not working together and she couldn’t do anything.

“Are you feeling all right?” I asked her.

“I feel all sleepy,” she said.

In an hour, she was unconscious. In 12 hours she was dead.

The measles had turned into a terrible thing called measles encephalitis and there was nothing the doctors could do to save her.

That was 24 years ago in 1962, but even now, if a child with measles happens to develop the same deadly reaction from measles as Olivia did, there would still be nothing the doctors could do to help her.

On the other hand, there is today something that parents can do to make sure that this sort of tragedy does not happen to a child of theirs. They can insist that their child is immunised against measles.

I was unable to do that for Olivia in 1962 because in those days a reliable measles vaccine had not been discovered. Today a good and safe vaccine is available to every family and all you have to do is to ask your doctor to administer it.

It is not yet generally accepted that measles can be a dangerous illness. Believe me, it is. In my opinion parents who now refuse to have their children immunised are putting the lives of those children at risk.

In America, where measles immunisation is compulsory, measles like smallpox, has been virtually wiped out.

Here in Britain, because so many parents refuse, either out of obstinacy or ignorance or fear, to allow their children to be immunised, we still have a hundred thousand cases of measles every year.

Out of those, more than 10,000 will suffer side effects of one kind or another. At least 10,000 will develop ear or chest infections. About 20 will die.

LET THAT SINK IN.

Every year around 20 children will die in Britain from measles.

So what about the risks that your children will run from being immunised?

They are almost non-existent. Listen to this. In a district of around 300,000 people, there will be only one child every 250 years who will develop serious side effects from measles immunisation! That is about a million to one chance.

I should think there would be more chance of your child choking to death on a chocolate bar than of becoming seriously ill from a measles immunisation.

So what on earth are you worrying about? It really is almost a crime to allow your child to go unimmunised.

The ideal time to have it done is at 13 months, but it is never too late. All school-children who have not yet had a measles immunisation should beg their parents to arrange for them to have one as soon as possible.

Incidentally, I dedicated two of my books to Olivia, the first was ‘James and the Giant Peach’. That was when she was still alive. The second was ‘The BFG’, dedicated to her memory after she had died from measles.

You will see her name at the beginning of each of these books. And I know how happy she would be if only she could know that her death had helped to save a good deal of illness and death among other children.",0
train-1201,"In addition to climate-driven sea-level
change, local factors can also be
important and may dominate at some
locations. These include tectonic land
movements and subsidence resulting
from the extraction of ground water
or hydrocarbons, sediment loading
and compaction. Changes in sediment
supply can affect local erosion/
accretion of the coastline.",0
train-1202,"The clearest present-day impacts
of climate change in Australia and
elsewhere are seen in the natural
environment, and are associated
with warming temperatures and
increases in the number, duration
and severity of heatwaves. These
impacts include changes in the
growth and distribution of plants,
animals and insects; poleward shifts
in the distribution of marine species;
and increases in coral bleaching on
the Great Barrier Reef and Western
Australian reefs. Some of these
changes can directly affect human
activities; for example, through the
effects of changing distributions
of fish and other marine organisms
on commercial and recreational
fisheries, and the impacts of coral
bleaching on tourism. ",0
train-1203,"Climate change, whatever the
cause, has profoundly affected
human societies and the natural
environment in the past. Throughout
history there are examples of
societal collapse associated with
regional changes in climate, ranging
from the decline of the Maya in
Mexico (linked to drought) to
the disappearance of the Viking
community from Greenland in
the fifteenth century (linked to
decreasing temperatures). Some
of these regional climate changes
occurred rapidly, on timescales
similar to current rates of global
climate change.",0
train-1204,"Climate warming causes land and
ocean life to migrate away from
areas that have become too warm,
and towards areas that previously
were too cool. In many places,
climate change is likely to lead
to invasion by new species and
extinctions of some existing species
that will have nowhere to migrate,
for example because they are located
on mountain tops (Figure 7.1).
Seemingly small changes, such as the
loss of a key pollinating species, may
potentially have large impacts.
Carbon dioxide affects ecosystems
directly, both positively and
negatively. On land it enhances
growth in some trees and plants,
an effect sometimes called
‘CO2 fertilisation’. Absorption
of CO2 into the oceans causes
‘ocean acidification’, impeding
shell formation by organisms
such as corals and causing coral
deterioration or death.",0
train-1205,"Melting ice from Greenland and Antarctica contributes to about a third of the sea level rise we're seeing, Professor Smith said.
Greenland's ice sheet lost an average of 200 gigatons of ice a year, contributing up to two thirds of the sea level rise.

The majority of this ice loss was from thinning of coastal glaciers, which have been impacted by warmer summer temperatures melting the ice on the surface, and warmer ocean temperatures eroding the edges of the ice.
The satellite data showed Antarctica lost an average of 118 gigatons of ice in the same time frame.

While there are gains in ice coverage in the interior, due to increased snowfall, these did not outweigh the losses in coastal areas.

""The total amount of thinning vastly outweighs the small amount of thickening in the interior of the ice sheets,"" Professor Smith said.",0
train-1206,"Last summer was hot in Alaska.

How hot was it, you ask?

Well, last summer was so hot, salmon were literally cooking themselves in the rivers.

Bad joke? Perhaps. While you won’t find river-boiled salmon on the menu at your local seafood restaurant anytime soon, it’s a fact that last July, as Alaska and much of the Arctic experienced near-record warmth, the water temperature in some Alaskan rivers reached an unfathomable 82 degrees Fahrenheit (28 degrees Celsius). The abnormally warm waters led to mass salmon die-offs.",0
train-1207,"In findings published in the Proceedings of the National Academy of Sciences on Monday, an international team of archaeologists, climate scientists and ecologists said that if heat-trapping greenhouse gas emissions continue at the current pace, by 2070 billions of people will be living in conditions hotter than those that have allowed life to thrive for the past 6000 years.
For every 1C  of warming, one billion people will either have to migrate to cooler regions or adapt to extreme heat conditions, the study found.
Tim Kohler, an archaeologist at the University of Washington and co-author of the study said that these findings can be viewed as a worst case or ""business-as-usual"" scenario of ""what could happen if we don't change our ways.""",0
train-1208,"Australia's temperatures are increasing more than the global average, the nation's weather bureau says.
Bureau of Meteorology head of climate monitoring Karl Braganza said Australia had warmed by about 1.4 degrees Celsius while the rest of the world had increased by 1.1C.
""Australia warms slightly more than the global average,"" Dr Braganza told a Senate estimates committee in Canberra today.
When temperatures across the rest of the world increase by 3.4C on average - which was estimated in a recent report - Australia is projected to be closer to 4C, he said.",0
train-1209,"There was no way Jose Ramon Garcia, a food transporter in Venezuela, could afford new tires for his van at $350 each. Whether he opted to pay in U.S. currency or in the devalued local bolivar currency at the equivalent black market price, Garcia would have had to save up for years. Though used to expensive repairs, this one was too much and put him out of business.  Repairs cost an arm and a leg in Venezuela,  said the now-unemployed 42-year-old Garcia, who has a wife and two children to support in the southern city of Guayana.  There s no point keeping bolivars.  For a decade and a half, strict exchange controls have severely limited access to dollars. A black market in hard currency has spread in response, and as once-sky-high oil revenue runs dry, Venezuela s economy is in free-fall.  The practice adopted by gourmet and design stores in Caracas over the last couple of years to charge in dollars to a select group of expatriates or Venezuelans with access to greenbacks is fast spreading.  Food sellers, dental and medical clinics, and others are starting to charge in dollars or their black market equivalent - putting many basic goods and services out of reach for a large number of Venezuelans.  According to the opposition-led National Assembly, November s rise in prices topped academics  traditional benchmark for hyperinflation of more than 50 percent a month - and could end the year at 2,000 percent. The government has not published inflation data for more than a year.  I can t think in bolivars anymore, because you have to give a different price every hour,  said Yoselin Aguirre, 27, who makes and sells jewelry in the Paraguana peninsula and has recently pegged prices to the dollar.  To survive, you have to dollarize.  The socialist government of the late president Hugo Chavez in 2003 brought in the strict controls in order to curb capital flight, as the wealthy sought to move money out of Venezuela after a coup attempt and major oil strike the previous year. Oil revenue was initially able to bolster artificial exchange rates, though the black market grew and now is becoming unmanageable for the government.   President Nicolas Maduro has maintained his predecessor s policies on capital controls. Yet, the spread between the strongest official rate, of some 10 bolivars per dollar, and the black market rate, of around 110,000 per dollar, is now huge.  While sellers see a shift to hard currency as necessary, buyers sometimes blame them for speculating. Rafael Vetencourt, 55, a steel worker in Ciudad Guayana, needed a prostate operation priced at $250.   We don t earn in dollars. It s abusive to charge in dollars!  said Vetencourt, who had to decimate his savings to pay for the surgery. In just one year, Venezuela s currency has weakened 97.5 per cent against the greenback, meaning $1,000 of local currency purchased then would be worth just $25 now. Maduro blames black market rate-publishing websites such as DolarToday for inflating the numbers, part of an  economic war  he says is designed by the opposition and Washington to topple him. On Venezuela s borders with Brazil and Colombia, the prices of imported oil, eggs and wheat flour vary daily in line with the black market price for bolivars.  In an upscale Caracas market, cheese-filled arepas, the traditional breakfast made with corn flour, increased 65 percent in price in just two weeks, according to tracking by Reuters reporters. In the same period, a kilogram of ham jumped a whopping 171 percent. The runaway prices have dampened Christmas celebrations, which this season were characterized by shortages of pine trees and toys, as well as meat, chicken and cornmeal for the preparation of typical dishes. In one grim festive joke, a Christmas tree in Maracaibo, the country s oil capital and second city, was decorated with virtually worthless low-denomination bolivar bills. Most Venezuelans, earning just $5 a month at the black market rate, are nowhere near being able to save hard currency.  How do I do it? I earn in bolivars and have no way to buy foreign currency,  said Cristina Centeno, a 31-year-old teacher  who, like many, was seeking remote work online before Christmas in order to bring in some hard currency. ",0
train-1210,"The 2012 presidential election is still more than two weeks away, but on Friday a CBS News affiliate in Arizona called the race for President Barack Obama.

For 17 seconds, Phoenix, Arizona CBS News affiliate KPHO ran a lower third graphic that showed that Obama had won the Nov. 6 election over Gov. Mitt Romney with 99% of the precincts reporting. The lower third graphic appeared around 3:30 p.m. on Oct. 19, during an episode of “The People’s Court.”

The CBS News graphic showed Obama winning the election with 43 percent of the vote nationwide to Romney’s 40 percent -– or 40,237,966 votes to 38,116,216. It is unclear who garnered the other 17 percent in the fictional election results.

KPHO’s general manager did not return The Daily Caller’s request for comment by time of publication.

UPDATE 12:10 p.m.:

Michele Wallace of KPHO told TheDC that this was the result of a mistake made with a test graphic:

“On Friday October 19th during a test of KPHO- CBS 5’s election returns software we inadvertently aired a test graphic for about 15 seconds in an episode of Peoples Court,” Wallace said. “The mistake was caught quickly and taken off the screen. With the election about 2 weeks away, the TV station routinely tests its equipment to ensure our viewers have the very latest’s results on election night.  We regret the error and apologize to any viewer who was confused by the mistake.”",0
train-1211,"Alex Jones  a prominent conspiracy theorist and the host of a popular right-wing radio show  has apologized for helping to spread and promote the hoax known as Pizzagate. The admission on Friday by Mr. Jones  the host of ""The Alex Jones Show"" and the operator of the website Infowars  was striking. In addition to promoting the Pizzagate conspiracy theory  he has contended that the Sept. 11 attacks were inside jobs carried out by the United States government and that the 2012 shooting at Sandy Hook Elementary School in Newtown  Conn.  was a hoax concocted by those hostile to the Second Amendment. The Pizzagate theory  which posited with no evidence that top Democratic officials were involved with a satanic child pornography ring centered around Comet Ping Pong  a pizza restaurant in Washington  D.C.  grew in online forums before making its way to more visible venues  including Mr. Jones's show. And its prominence after the election drew attention to the proliferation of false and misleading news  much of it politically charged  that circulated on platforms like Facebook  Twitter and YouTube.",0
train-1212,"Amazon has made its first move into the Middle East after agreeing to buy the region's largest online retailer  Souq.com  for an undisclosed amount. Souq was launched in 2005 and offers more than 8.4 million products. It sells across 31 categories including consumer electronics  fashion  health and beauty  household goods and baby. ""Amazon and Souq share the same DNA. We're driven by customers  invention and long-term thinking  said Amazon senior vice-president Russ Grandinetti. Some reports have suggested Amazon is paying about $650m (£517m) for the company. The deal was revealed a day after Emaar Malls, the operator of Dubai's biggest mall, made an offer of $800m (£636m) for Souq.",0
train-1213,"Ford has said it will spend $1.2bn (£1bn) as part of a planned upgrade of three Michigan plants. It said $850m will be spent on retooling its factory in Wayne where Ford plans to build Bronco and Ranger models. In addition  Ford will create 130 jobs at its Romeo engine parts plant  it said in a statement. In January  the US car giant said it would cancel a $1.6bn plant it had planned to build in Mexico. US President Donald Trump  who put pressure on Ford over its planned Mexico investment  tweeted earlier on Tuesday: ""Big announcement by Ford today. Major investment to be made in three Michigan plants. Car companies coming back to US. JOBS! JOBS! JOBS!"" Ford's US investment announcement is largely in line with a previous agreement it reached with the United Auto Workers union.",0
train-1214,Westinghouse  Toshiba's US nuclear unit  has filed for US bankruptcy protection. The US firm has struggled with hefty losses that have thrown its Japanese parent into a crisis  putting the conglomerate's future at risk. Westinghouse has suffered huge cost overruns at two US projects in Georgia and South Carolina. Toshiba said the bankruptcy would not affect Westinghouse's UK operation  which employs more than 1 000 workers. However  the firm warned that the writedown of its US nuclear business could see Toshiba's total losses last year exceed 1 trillion yen ($9.1bn; £7.3bn)  almost triple its previous estimate. The Japanese government confirmed on Wednesday that it was aware of Toshiba's plans.,0
train-1215,"European Union regulators dealt a final blow to Deutsche Boerse AG's planned takeover of London Stock Exchange Group Plc  a symbolic block on EU-U.K. integration on the same day Britain formally serves notice of its decision to quit the EU. The $14 billion deal to create Europe's biggest exchange would have harmed competition in the soon-to-be 27-nation EU by creating a de facto monopoly for clearing bonds and repurchase agreements  the European Commission said in an emailed statement Wednesday. The decision  flagged last month by LSE  thwarts Deutsche Boerse's expansion just five years after the EU also banned a proposed tie-up with NYSE Euronext. ""The commission cannot allow the creation of monopolies and that is what would have happened in this case  Margrethe Vestager, the EU's antitrust commissioner, told reporters in Brussels. LSE was not prepared"" to sell a small unit that would have removed concerns that the combined firm could have weakened rival Euronext NV. EU regulators have become increasingly tough on big deals  demanding weighty concessions to eliminate overlapping businesses amid concerns that a combined firm could dominate an industry and increase prices. While this is the second time that Vestager has formally blocked a merger  several transactions have been ditched over antitrust opposition.",0
train-1216,"Uber will shut down its operation in Denmark next month following the introduction of new taxi laws  the company has said  marking the latest European setback for the US ride-booking service. A company spokesman  Kristian Agerbo  said on Tuesday Uber ""must take the consequences"" of the rules  which among other things will require cabs to be fitted with seat occupancy sensors and fare meters.Uber suspends fleet of self-driving cars following Arizona crash. Uber has faced problems in cities including Madrid  Frankfurt  Paris and London  and is awaiting a decision from the European court of justice that could determine how it is regulated on the continent: as a transport service or a digital platform.",0
train-1217,Tesco is to pay out £235m to settle investigations by the Serious Fraud Office and Financial Conduct Authority into the 2014 accounting scandal that rocked Britain's biggest retailer. It will pay a fine of £129m as part of a deferred prosecution agreement (DPA) with the SFO  although this deal requires court approval. The DPA relates to Tesco subsidiary Tesco Stores Ltd. The supermarket group has separately agreed with the FCA to pay about £85m in compensation to investors affected by a trading statement on 29 August 2014 that overstated profits. Tesco will also pay legal costs associated with the agreements and said the total exceptional charge was expected to be £235m.,0
train-1218,"BrewDog threatened legal action to prevent a bar from using the term ""punk"" in its name  it has emerged  a day after the brewer blamed ""trigger-happy"" lawyers for a similar dispute that sparked a social media backlash. The brewer  which has been a vocal critic of the behaviour of large corporations  raised an objection to plans by music promoter Tony Green to open a bar in Leeds called Draft Punk. Green  who says the name was a tongue-in-cheek reference to French dance music act Daft Punk  said the ""intimidating"" threat contravened the punk movement spirit that BrewDog claims to espouse.",0
train-1219,"Study says  ""More than 10 million UK workers are at high risk of being replaced by robots within 15 years as the automation of routine tasks gathers pace in a new machine age. A report by the consultancy firm PwC found that 30% of jobs in Britain were potentially under threat from breakthroughs in artificial intelligence (AI). In some sectors half the jobs could go. The report predicted that automation would boost productivity and create fresh job opportunities  but it said action was needed to prevent the widening of inequality that would result from robots increasingly being used for low-skill tasks. PwC said 2.25 million jobs were at high risk in wholesale and retailing – the sector that employs most people in the UK – and 1.2 million were under threat in manufacturing  1.1 million in administrative and support services and 950 000 in transport and storage.",0
train-1220,"Brexit negotiations are on course to fail unless both Britain and the European Union ditch their winner-takes-all approach to the coming talks  the former president of the European commission José Manuel Barroso has said. With just days to go before Theresa May formally notifies Brussels of the UK's intention to leave the EU  Jean-Claude Juncker's predecessor said the two sides were playing a dangerous game. The UK's prime minister has said she believes ""no deal is better than a bad deal""  and some in her cabinet have openly talked up the prospect of walking away from the negotiating table.",0
train-1221,"Yahoo and AOL with advertisers'  ""Snapchat could become more popular with advertisers than Twitter  Yahoo and AOL within three years  with the messaging app company forecast to be bring in revenues of more than $3bn (£2.4bn) a year by the end of 2019. That bullish forecast is based on advertisers targeting the hard-to-reach youth audience that Snapchat has seemingly cornered. More than half (51%) of video users on the app are under 24  compared with 23% for Facebook and 17% for Google's YouTube (17%)  according to Ampere Analysis. Brands are also keen to see a true rival emerge to challenge Facebook and Google  which have recently come in for heavy criticism for their advertising practices. The two web giants currently account for 58% of the $141bn global mobile ad market.",0
train-1222,For more than two decades  free trade has been at the heart of Mexico's relationship with America  responsible for pumping a stream of vehicles  audio components and avocados north and cheap corn  cattle and software south. To the nation's leaders  it was central  vital  nonnegotiable. At least until President Trump came along  promising to upend nearly $500 billion in annual trade between the two countries if it could not be re-engineered more in America's favor. Now  the Mexico's leaders have a new priority: urging their American counterparts to hurry up and get on with it. While free trade has long been an article of faith in Mexico  uncertainty over the fate of the North American Free Trade Agreement is hitting the country hard.,0
train-1223,"Setting Up Face-Off With Trump  ""California's clean-air agency voted on Friday to push ahead with stricter emissions standards for cars and trucks  setting up a potential legal battle with the Trump administration over the state's plan to reduce planet-warming gases. The vote  by the California Air Resources Board  is the boldest indication yet of California's plan to stand up to President Trump's agenda. Leading politicians in the state  from the governor down to many mayors  have promised to lead the resistance to Mr. Trump's policies. Mr. Trump  backing industry over environmental concerns  said easing emissions rules would help stimulate auto manufacturing. He vowed last week to loosen the regulations. Automakers are aggressively pursuing those changes after years of supporting stricter standards.",0
